{
  "schema_version": 1,
  "title": "CHECK IS SIX SMALL TESTS — NOT ONE MAGIC VERDICT",
  "question": "What does eval-evidence check actually do?",
  "takeaway": "Check turns a run directory into six inspectable operations and reports exactly which scoped test passed or failed.",
  "readers": ["engineer", "team", "agent-ci"],
  "reading_speeds": {
    "at_2_seconds": "A run passes through six visible gates before a report appears.",
    "at_20_seconds": "Discovery, parsing, provenance mapping, schema/digest validation, local file re-hashing, and reporting are separate operations.",
    "at_2_minutes": "The report boundary distinguishes current structural and byte-identity checks from runner authenticity, score truth, and model comparability."
  },
  "archetype": "proof-boundary",
  "medium": {"kind": "svg", "rationale": "The exact gate order, pass/fail branches, and non-claims must remain unambiguous in code review and CI."},
  "evidence_sources": [
    {"id": "cli-check", "path": "eval_evidence/__main__.py", "authority": "source-of-truth"},
    {"id": "adapter", "path": "eval_evidence/adapters.py", "authority": "source-of-truth"},
    {"id": "core", "path": "eval_evidence/core.py", "authority": "source-of-truth"},
    {"id": "trust", "path": "docs/TRUST_MODEL.md", "authority": "source-of-truth"}
  ],
  "labels": [
    {"text": "1  FIND THE RUN", "claim": "Check discovers supported run roots with the chosen or auto-detected adapter.", "source_ids": ["cli-check", "adapter"]},
    {"text": "2  READ THE FILES", "claim": "The adapter loads required JSON objects and rejects malformed inputs.", "source_ids": ["adapter"]},
    {"text": "3  LABEL EACH FIELD", "claim": "Normalized evidence fields retain status and source provenance.", "source_ids": ["adapter", "core"]},
    {"text": "4  TEST THE RECORD", "claim": "The in-memory bundle is checked against its schema and embedded bundle digest.", "source_ids": ["cli-check", "core"]},
    {"text": "5  RE-HASH LOCAL FILES", "claim": "Referenced paths are resolved safely and their presence, size, and SHA-256 are compared.", "source_ids": ["cli-check", "core"]},
    {"text": "6  NAME THE RESULT", "claim": "Check emits validity, coverage, errors, warnings, and scoped summary counts.", "source_ids": ["cli-check"]},
    {"text": "PASS", "claim": "No requested structural, digest, referenced-file, or coverage-policy check failed now.", "source_ids": ["cli-check", "core"]},
    {"text": "FAIL + REASON", "claim": "At least one scoped check or requested coverage policy failed, with errors reported.", "source_ids": ["cli-check", "core"]},
    {"text": "CHECKED NOW", "claim": "The green boundary lists the facts check inspects in the current run.", "source_ids": ["cli-check", "core"]},
    {"text": "STILL NOT PROVEN", "claim": "The red boundary lists authenticity, truth, and comparability claims outside check scope.", "source_ids": ["cli-check", "trust"]}
  ],
  "boundaries": ["Check does not write a stored baseline.", "Check runs no model and does not authenticate a runner.", "Evidence coverage is not a comparability or claim-readiness score."],
  "forbidden_claims": ["ONE TRUST VERDICT", "TRUSTED RUNNER", "PROVES SCORE CORRECT", "PROVES MODELS COMPARABLE", "CERTIFIED"],
  "accessibility": {
    "alt_text": "Eval Evidence check passes a run through six explicit gates: discover, read, label provenance, validate record, re-hash local files, and report pass or fail with reasons.",
    "long_description": "Six numbered cards run left to right in two rows. The first three find the run, read its files, and label each field. The next three test the record, re-hash local files, and name the result. The final report branches to Pass or Fail plus reason. A bottom proof boundary says what was checked now and what remains unproven.",
    "color_independent_cues": ["numbered gate order", "directional arrows", "checkmark and cross symbols", "separate checked and not-proven panels"],
    "minimum_text_px": 20
  },
  "provenance": {"repository": "https://github.com/edward-lcl/eval-evidence", "revision": "content-addressed semantic and render inputs", "brief_path": "figures/eval-evidence-check-story.figure.json", "method": "deterministic SVG from validated semantic brief and paired render manifest", "generated_image_used": false},
  "output": {"path": "figures/eval-evidence-check-story.svg", "embed_location": "README quickstart explanation", "format": "svg"}
}
