{
  "schema_version": 1,
  "title": "ONE BYTE CHANGES. VERIFY NAMES IT.",
  "question": "What does a saved bundle detect when a referenced file changes later?",
  "takeaway": "A saved fingerprint and a later fingerprint differ, so verify reports the referenced file mismatch instead of hiding the change.",
  "readers": ["engineer", "team", "agent-ci"],
  "reading_speeds": {
    "at_2_seconds": "Saved and current fingerprints differ.",
    "at_20_seconds": "Bundle records result.json at baseline time; verify with run root re-hashes it later and names the mismatch.",
    "at_2_minutes": "The exact error and digest examples come from one render manifest, while adjacent prose preserves the limits of an unsigned retrospective baseline."
  },
  "archetype": "lifecycle-evidence-path",
  "medium": {"kind": "svg", "rationale": "The before/after fingerprints and exact mismatch text require deterministic, shared desktop/mobile semantics."},
  "evidence_sources": [
    {"id": "cli", "path": "eval_evidence/__main__.py", "authority": "source-of-truth"},
    {"id": "core", "path": "eval_evidence/core.py", "authority": "source-of-truth"},
    {"id": "lifecycle", "path": "docs/LIFECYCLE.md", "authority": "source-of-truth"},
    {"id": "trust", "path": "docs/TRUST_MODEL.md", "authority": "source-of-truth"}
  ],
  "labels": [
    {"text": "SAVE", "claim": "Bundle records the selected file fingerprint at baseline time.", "source_ids": ["cli", "core"]},
    {"text": "CHANGE", "claim": "The referenced file may later contain different bytes.", "source_ids": ["lifecycle", "trust"]},
    {"text": "VERIFY", "claim": "Verify with run root re-hashes the current referenced file.", "source_ids": ["cli", "core"]},
    {"text": "EXPECTED", "claim": "The expected digest comes from the saved bundle.", "source_ids": ["core"]},
    {"text": "ACTUAL", "claim": "The actual digest is computed from current local bytes.", "source_ids": ["core"]},
    {"text": "MISMATCH · EXIT 1", "claim": "A referenced-file digest mismatch fails verification with exit one.", "source_ids": ["cli", "core"]},
    {"text": "Referenced file digest mismatch for result.json", "claim": "The report names the changed reference.", "source_ids": ["core"]}
  ],
  "boundaries": ["The bundle must be retained separately from the source files to serve as a later baseline.", "Anyone who edits an unsigned bundle can recompute its embedded digest.", "A mismatch detects changed bytes; it does not identify an actor or determine which value is true."],
  "forbidden_claims": ["ATTRIBUTED TO AN ACTOR", "ORIGINAL RUN PROVEN", "TAMPER-PROOF", "AUTHENTICATED BASELINE", "TRUE SCORE"],
  "accessibility": {
    "alt_text": "A saved result.json fingerprint differs from its later fingerprint, so verify reports a referenced-file digest mismatch and exits one.",
    "long_description": "A compact three-step line reads Save, Change, Verify. Save records result.json with reward one and digest 8d14 through a6c2. Change shows reward zero and digest f913 through 7b40. Verify compares expected and actual fingerprints, displays a not-equal sign, and reports the named result.json mismatch with exit one.",
    "color_independent_cues": ["three numbered verbs", "before and after values", "expected and actual labels", "not-equal symbol", "exact error text"],
    "minimum_text_px": 20
  },
  "provenance": {"repository": "https://github.com/edward-lcl/eval-evidence", "revision": "content-addressed semantic and render inputs", "brief_path": "figures/eval-evidence-tamper-story.figure.json", "method": "deterministic SVG from validated semantic brief and paired render manifest", "generated_image_used": false},
  "output": {"path": "figures/eval-evidence-tamper-story.svg", "embed_location": "README verification boundary", "format": "svg"}
}
